Title,Subtitle,Price,Size,Location,Status,Image URL,Features
Luxury Villa in Downtown,Spacious 4BHK villa with garden and parking,2.5Cr,3500 sqft,Downtown,Buy,https://images.unsplash.com/photo-1600585154340-be6161a56a0c?w=800,"4 BHK, Garden, Parking, Modern amenities"
Cozy Apartment in Suburbs,2BHK furnished apartment ready to move in,25K/month,1200 sqft,Suburbs,Rent,https://images.unsplash.com/photo-1522708323590-d24dbb6b0267?w=800,"Furnished, 2 BHK, Ready to move, Near metro"
Prime Land Near Highway,Agricultural land with road access and water supply,35L,2 kanal,Highway,Land,https://images.unsplash.com/photo-1500382017468-9049fed747ef?w=800,"Road access, Water, 15 min to city, Clear title"
Modern Office Space,Premium office space in business district,1.8Cr,2500 sqft,Business District,Buy,https://images.unsplash.com/photo-1497366216548-37526070297c?w=800,"Ready to move, Parking, 24/7 access, AC"
Family House with Pool,Beautiful 3BHK house with swimming pool,40K/month,2800 sqft,Green Valley,Rent,https://images.unsplash.com/photo-1512917774080-9991f1c4c750?w=800,"3 BHK, Pool, Garden, Pet friendly"
Commercial Plot,Strategic location for commercial development,1.2Cr,5 kanal,Main Road,Land,https://images.unsplash.com/photo-1500382017468-9049fed747ef?w=800,"Corner plot, Road facing, Clear title, NOC ready"
